{
  "layout": {
    "direction": "LR",
    "portBinding": "auto",
    "areaFirst": true,
    "areaPadding": 24
  },
  "areas": [
    {
      "id": "control-room",
      "label": "Control Room"
    },
    {
      "id": "equipment-rack",
      "label": "Equipment Rack",
      "parentId": "control-room"
    },
    {
      "id": "studio-floor",
      "label": "Studio Floor"
    }
  ],
  "nodes": [
    {
      "id": "camera1",
      "manufacturer": "Sony",
      "model": "PXW-Z450",
      "category": "video",
      "status": "Regular",
      "areaId": "studio-floor",
      "ports": {
        "sdi_out": {
          "alignment": "Out",
          "label": "SDI Out",
          "type": "SDI",
          "gender": "F"
        },
        "power_in": {
          "alignment": "In",
          "label": "Power",
          "type": "PowerCON",
          "gender": "M"
        }
      }
    },
    {
      "id": "camera2",
      "manufacturer": "Sony",
      "model": "PXW-Z450",
      "category": "video",
      "status": "Existing",
      "areaId": "studio-floor",
      "ports": {
        "sdi_out": {
          "alignment": "Out",
          "label": "SDI Out",
          "type": "SDI",
          "gender": "F"
        },
        "power_in": {
          "alignment": "In",
          "label": "Power",
          "type": "PowerCON",
          "gender": "M"
        }
      }
    },
    {
      "id": "switcher",
      "manufacturer": "Blackmagic",
      "model": "ATEM 2 M/E",
      "category": "video",
      "status": "Regular",
      "areaId": "equipment-rack",
      "ports": {
        "sdi_in_1": {
          "alignment": "In",
          "label": "SDI In 1",
          "type": "SDI",
          "gender": "F"
        },
        "sdi_in_2": {
          "alignment": "In",
          "label": "SDI In 2",
          "type": "SDI",
          "gender": "F"
        },
        "sdi_out_pgm": {
          "alignment": "Out",
          "label": "PGM Out",
          "type": "SDI",
          "gender": "F"
        },
        "ethernet": {
          "alignment": "Bidirectional",
          "label": "Ethernet",
          "type": "RJ45",
          "gender": "F"
        }
      }
    },
    {
      "id": "monitor",
      "manufacturer": "Sony",
      "model": "BVM-HX310",
      "category": "video",
      "status": "Regular",
      "areaId": "control-room",
      "ports": {
        "sdi_in": {
          "alignment": "In",
          "label": "SDI In",
          "type": "SDI",
          "gender": "F"
        }
      }
    },
    {
      "id": "network-switch",
      "manufacturer": "Cisco",
      "model": "Catalyst 2960",
      "category": "network",
      "status": "Regular",
      "areaId": "equipment-rack",
      "ports": {
        "eth1": {
          "alignment": "Bidirectional",
          "label": "Port 1",
          "type": "RJ45",
          "gender": "F"
        },
        "eth2": {
          "alignment": "Bidirectional",
          "label": "Port 2",
          "type": "RJ45",
          "gender": "F"
        }
      }
    },
    {
      "id": "pdu",
      "manufacturer": "APC",
      "model": "AP7900",
      "category": "power",
      "status": "Regular",
      "areaId": "equipment-rack",
      "ports": {
        "outlet1": {
          "alignment": "Out",
          "label": "Outlet 1",
          "type": "PowerCON",
          "gender": "F"
        },
        "outlet2": {
          "alignment": "Out",
          "label": "Outlet 2",
          "type": "PowerCON",
          "gender": "F"
        }
      }
    }
  ],
  "edges": [
    {
      "id": "cam1-to-switcher",
      "wireId": "SDI-001",
      "category": "video",
      "cableType": "SDI",
      "label": "Camera 1 Feed",
      "source": "camera1",
      "sourcePortKey": "sdi_out",
      "target": "switcher",
      "targetPortKey": "sdi_in_1",
      "binding": "exact"
    },
    {
      "id": "cam2-to-switcher",
      "wireId": "SDI-002",
      "category": "video",
      "cableType": "SDI",
      "label": "Camera 2 Feed",
      "source": "camera2",
      "sourcePortKey": "sdi_out",
      "target": "switcher",
      "targetPortKey": "sdi_in_2",
      "binding": "exact"
    },
    {
      "id": "switcher-to-monitor",
      "wireId": "SDI-003",
      "category": "video",
      "cableType": "SDI",
      "label": "Program Output",
      "source": "switcher",
      "sourcePortKey": "sdi_out_pgm",
      "target": "monitor",
      "targetPortKey": "sdi_in",
      "binding": "exact"
    },
    {
      "id": "switcher-network",
      "wireId": "CAT6-001",
      "category": "network",
      "cableType": "CAT6",
      "label": "Control Network",
      "source": "switcher",
      "sourcePortKey": "ethernet",
      "target": "network-switch",
      "targetPortKey": "eth1",
      "binding": "exact"
    },
    {
      "id": "pdu-to-cam1",
      "wireId": "PWR-001",
      "category": "power",
      "cableType": "PowerCON",
      "label": "Power to Camera 1",
      "source": "pdu",
      "sourcePortKey": "outlet1",
      "target": "camera1",
      "targetPortKey": "power_in",
      "binding": "exact"
    },
    {
      "id": "pdu-to-cam2",
      "wireId": "PWR-002",
      "category": "power",
      "cableType": "PowerCON",
      "label": "Power to Camera 2",
      "source": "pdu",
      "sourcePortKey": "outlet2",
      "target": "camera2",
      "targetPortKey": "power_in",
      "binding": "exact"
    }
  ],
  "metadata": {
    "project": "Complex Example",
    "description": "Multiple nodes in multiple areas with video, network, and power connections"
  }
}
